{
  "kicker": "맺음",
  "title": "요약과 다음 행동",
  "points": [
    { "text": "보고서 공간이 개인과 조직으로 갈려 혼선이 사라진다", "note": "게시는 사본 아닌 링크" },
    { "text": "편집 권한은 게시판별 정책과 잠금으로 판정한다", "note": "잠금이 정책보다 앞선다" },
    { "text": "위젯 35종으로 표·차트·관계도를 한 화면에 담는다", "note": "입력 키 규약 준수 필요" },
    { "text": "배포는 apptainer SIF 단일 이미지로 고정한다", "note": "운영 DB 는 5433 포트" }
  ],
  "actions_title": "다음 행동",
  "actions": [
    { "text": "Phase 3 검증 스크립트 잔여 항목 마감", "owner": "개발팀", "due": "2026-08-15" },
    { "text": "게시판 편집 정책 기본값 공지", "owner": "운영팀", "due": "2026-08-01" },
    { "text": "온보딩 문서에 위젯 선택 가이드 반영", "owner": "문서팀", "due": "2026-08-22" }
  ],
  "note": "세부 근거는 본문 4장과 5장을 함께 확인한다",
  "page": { "no": "28", "total": "28" },
  "footer": { "left": "ReportArchive 사용 설명서 · 2026-05-27", "right": "내부 배포용" }
}
