{
  "kicker": "결론과 후속 조치",
  "title": "검토 결과 요약과 다음 행동 정리",
  "points": [
    { "text": "보고서 공간 분리로 개인 초안과 조직 공식본의 혼선이 사라진다", "note": "게시는 사본 아닌 링크로" },
    { "text": "편집 권한은 게시판별 정책과 작성자 잠금 순서로 판정된다", "note": "잠금이 모든 정책에 앞선다" },
    { "text": "위젯 35종으로 표와 차트와 관계도를 한 화면에서 조합한다", "note": "입력 키 규약 준수가 전제" },
    { "text": "배포는 apptainer SIF 단일 이미지로 고정해 재현성을 지킨다", "note": "운영 DB 는 5433 포트 사용" },
    { "text": "남은 일은 내 공간 hub 와 종합보고 탭 분리 두 건뿐이다", "note": "화면 재설계가 함께 걸린다" }
  ],
  "actions_title": "후속 조치 정리",
  "actions": [
    { "text": "Phase 3 검증 스크립트 잔여 항목 마감 처리", "owner": "개발지원팀", "due": "2026-08-15" },
    { "text": "게시판 편집 정책 기본값 전사 공지 발송", "owner": "운영지원팀", "due": "2026-08-01" },
    { "text": "온보딩 문서에 위젯 선택 가이드 전면 반영", "owner": "문서관리팀", "due": "2026-08-22" },
    { "text": "종합보고 탭 분리 설계안 초안 검토 회의", "owner": "플랫폼기획", "due": "2026-09-05" }
  ],
  "note": "세부 근거는 본문 4장 권한 모델과 5장 배포 계획을 확인",
  "page": { "no": "28", "total": "28" },
  "footer": { "left": "ReportArchive 사용 설명서 · 2026-05-27 갱신본", "right": "내부 배포 전용" }
}
